subject_id,trial,condition,stimulus,subject_title,title_time,subject_rating,rating_time,a1_id,a1_name,a1_rating,a1_title,a2_id,a2_name,a2_rating,a2_title,a3_id,a3_name,a3_rating,a3_title,a4_id,a4_name,a4_rating,a4_title,a5_id,a5_name,a5_rating,a5_title,a6_id,a6_name,a6_rating,a6_title,selection_time_1,selection_time_2,selection_time_3,kept_1_loc,kept_1_id,kept_1_name,kept_1_rating,kept_1_title,kept_2_loc,kept_2_id,kept_2_name,kept_2_rating,kept_2_title,kept_3_loc,kept_3_id,kept_3_name,kept_3_rating,kept_3_title,elim_1_loc,elim_1_id,elim_1_name,elim_1_rating,elim_1_title,elim_2_loc,elim_2_id,elim_2_name,elim_2_rating,elim_2_title,elim_3_loc,elim_3_id,elim_3_name,elim_3_rating,elim_3_title
27,1,eliminate,12,alarmed for his safety,10.18454321,3.0,2.99616709242,23,Morgan,2.0,I feel sorry for the man on the ground.,25,Jasmine,5.0,seems a bit extreme,15,Lauren,3.0,This is just another person being arested.,51,Natalie,5.0,I feel nervous and scared,52,Brooke,7.0,that man looks like he needs help,60,Sierra,9.0,This looks like a form of police brutality,7.12672058891,8.19381899462,9.37704389426,2,25,Jasmine,5.0,seems a bit extreme,5,52,Brooke,7.0,that man looks like he needs help,6,60,Sierra,9.0,This looks like a form of police brutality,4,51,Natalie,5.0,I feel nervous and scared,3,15,Lauren,3.0,This is just another person being arested.,1,23,Morgan,2.0,I feel sorry for the man on the ground.
27,2,eliminate,8,concern for his safety,7.93525482392,3.0,3.53606479792,6,Taylor,3.0,I'm not sure why it takes so many officers to move one guy.,25,Jasmine,5.0,I am not sure what to think,5,Sarah,5.0,why are there so many policemen trying to take this man down,42,Kaitlyn,5.0,A black man is being arrested and held by police officers.,52,Brooke,7.0,"again, all these cops for one person",60,Sierra,6.0,This looks like the police arresting a peaceful protester.,8.91537097436,14.4831322416,15.8176783026,1,6,Taylor,3.0,I'm not sure why it takes so many officers to move one guy.,2,25,Jasmine,5.0,I am not sure what to think,6,60,Sierra,6.0,This looks like the police arresting a peaceful protester.,4,42,Kaitlyn,5.0,A black man is being arrested and held by police officers.,3,5,Sarah,5.0,why are there so many policemen trying to take this man down,5,52,Brooke,7.0,"again, all these cops for one person"
27,3,eliminate,20,he looks like he's in pain-- concern,13.2369021417,5.0,2.01544880713,6,Taylor,4.0,I'm not sure if the man is in pain or just upset.,25,Jasmine,5.0,Seems like a normal arrest,30,Katherine,5.0,"Nothing stands out in this picture, the man is under arrest for something and is yelling.",13,Megan,7.0,Please stop the crime!,63,Vanessa,7.0,I feel surprised and uncomfortable.,60,Sierra,9.0,This looks like a case of excessive force,2.22013331357,7.3555389563,8.08934432305,1,6,Taylor,4.0,I'm not sure if the man is in pain or just upset.,5,63,Vanessa,7.0,I feel surprised and uncomfortable.,6,60,Sierra,9.0,This looks like a case of excessive force,3,30,Katherine,5.0,"Nothing stands out in this picture, the man is under arrest for something and is yelling.",4,13,Megan,7.0,Please stop the crime!,2,25,Jasmine,5.0,Seems like a normal arrest
27,4,eliminate,16,discomfort and concern,11.3946668871,4.0,3.1371031384,6,Taylor,6.0,Somebody needs to help that man.,54,Heather,8.0,"I feel saddened by this photo, the guy looks like he's afraid. ",24,Danielle,3.0,Black male on the ground being handcuffed by police.,7,Hannah,3.0,This picture is similar to many of the others in that my response is wondering what led up to the man on the ground being subdued in this manner,63,Vanessa,7.0,I feel upset and confused.,60,Sierra,9.0,This looks like a case of racial profiling and police brutality,7.45546482985,8.60590075039,10.3559956893,2,54,Heather,8.0,"I feel saddened by this photo, the guy looks like he's afraid. ",5,63,Vanessa,7.0,I feel upset and confused.,6,60,Sierra,9.0,This looks like a case of racial profiling and police brutality,4,7,Hannah,3.0,This picture is similar to many of the others in that my response is wondering what led up to the man on the ground being subdued in this manner,3,24,Danielle,3.0,Black male on the ground being handcuffed by police.,1,6,Taylor,6.0,Somebody needs to help that man.
27,5,eliminate,13,Discomfort with American racial politics,16.5799701784,4.0,2.88097003011,53,Marissa,1.0,Powerful image,54,Heather,9.0,"I feel tense by looking at this photo, it looks like a lot of violence. ",36,Abigail,6.0,Are they picking that person up or beating him down?,14,Alexis,5.0,People want to make a difference but they are doing the wrong things. ,63,Vanessa,6.0,I feel upset and sad.,60,Sierra,8.0,This looks like a case of police brutality,2.21330598257,3.98092926056,5.51415045388,2,54,Heather,9.0,"I feel tense by looking at this photo, it looks like a lot of violence. ",5,63,Vanessa,6.0,I feel upset and sad.,6,60,Sierra,8.0,This looks like a case of police brutality,1,53,Marissa,1.0,Powerful image,3,36,Abigail,6.0,Are they picking that person up or beating him down?,4,14,Alexis,5.0,People want to make a difference but they are doing the wrong things. 
27,6,eliminate,6,Concern for that man,9.20509562312,3.0,3.92200899781,1,Jessica,4.0,He's no longer a threat.,54,Heather,8.0,I feel sorrow for the man being apprehended by all the officers. ,21,Brianna,7.0,Protesting at rally goes wrong police steps in,40,Mary,3.0,I feel sad for the person being dragged away,63,Vanessa,7.0,I feel shocked and ashamed of American society.,60,Sierra,8.0,This looks like a case of racial profiling by the police,3.70495221695,6.40616019296,10.5081524838,2,54,Heather,8.0,I feel sorrow for the man being apprehended by all the officers. ,5,63,Vanessa,7.0,I feel shocked and ashamed of American society.,6,60,Sierra,8.0,This looks like a case of racial profiling by the police,1,1,Jessica,4.0,He's no longer a threat.,3,21,Brianna,7.0,Protesting at rally goes wrong police steps in,4,40,Mary,3.0,I feel sad for the person being dragged away
27,7,eliminate,10,Disgust with the police,10.4643477443,6.0,3.09402512316,48,Kelly,4.0,I honestly feel like I've seen so much police violence that I feel desensitized to it now.,54,Heather,9.0,I feel sad that the guy is being dragged by the police officers. ,31,Anna,3.0,Many of the protesters were uncooperative and as a result were arrested.,44,Maria,1.0,lol funny pic carry him like that people just cant control themselves,63,Vanessa,6.0,I feel saddened by racial injustice and the violence in America today.,60,Sierra,8.0,This looks almost looks like a scene from the 60's civil rights movement,4.60195636803,10.7358848987,14.8209555469,1,48,Kelly,4.0,I honestly feel like I've seen so much police violence that I feel desensitized to it now.,2,54,Heather,9.0,I feel sad that the guy is being dragged by the police officers. ,5,63,Vanessa,6.0,I feel saddened by racial injustice and the violence in America today.,4,44,Maria,1.0,lol funny pic carry him like that people just cant control themselves,3,31,Anna,3.0,Many of the protesters were uncooperative and as a result were arrested.,6,60,Sierra,8.0,This looks almost looks like a scene from the 60's civil rights movement
27,8,eliminate,4,Discomfort with the situation,15.4703679523,2.0,3.75846866162,48,Kelly,6.0,I feel really frightened for the man because he looks really scared himself. ,54,Heather,9.0,I feel sad by seeing the fear in this mans eyes.,11,Kayla,3.0,Shouldn't be in the road protesting.  ,58,Paige,7.0,This is the picture of a criminal. ,63,Vanessa,6.0,I feel regret and shock.,34,Allison,6.0,The person in this photo looks scared. ,2.52873084116,5.01237940197,10.7313269775,1,48,Kelly,6.0,I feel really frightened for the man because he looks really scared himself. ,2,54,Heather,9.0,I feel sad by seeing the fear in this mans eyes.,5,63,Vanessa,6.0,I feel regret and shock.,3,11,Kayla,3.0,Shouldn't be in the road protesting.  ,4,58,Paige,7.0,This is the picture of a criminal. ,6,34,Allison,6.0,The person in this photo looks scared. 
27,9,eliminate,2,Sympathy for the woman,10.4455623917,7.0,3.03239382812,48,Kelly,3.0,I feel upset because it looks like she didn't really do anything wrong. ,54,Heather,9.0,I feel sad by  looking at this picture. It looks like she was arrested during a raid or riot.,28,Rebecca,1.0,What did she expect?,32,Haley,5.0,she doesnt seem like the type to get arrested,63,Vanessa,6.0,I feel sad and as if it could be prevented.,27,Alyssa,7.0,Law enforcement arrests woman accused of killing child.,1.39705375878,2.7636073351,3.13104187574,1,48,Kelly,3.0,I feel upset because it looks like she didn't really do anything wrong. ,2,54,Heather,9.0,I feel sad by  looking at this picture. It looks like she was arrested during a raid or riot.,5,63,Vanessa,6.0,I feel sad and as if it could be prevented.,6,27,Alyssa,7.0,Law enforcement arrests woman accused of killing child.,3,28,Rebecca,1.0,What did she expect?,4,32,Haley,5.0,she doesnt seem like the type to get arrested
27,10,eliminate,9,alarm-- looks like he's in pain,7.90791841529,5.0,2.93440379527,48,Kelly,5.0,I feel unhappy because I don't like seeing racism like this. ,54,Heather,9.0,"I feel sad, it looks like the person is grieving and in pain. ",29,Madison,1.0,Yet another person who is crying about being detained by the police. Ridiculous.,57,Miranda,9.0,He looks like hes in pain,63,Vanessa,7.0,I feel the numbers are unfair.,26,Alexandra,1.0,Where was your father for all of this?,5.91255901606,7.22934523538,8.31332251847,1,48,Kelly,5.0,I feel unhappy because I don't like seeing racism like this. ,2,54,Heather,9.0,"I feel sad, it looks like the person is grieving and in pain. ",4,57,Miranda,9.0,He looks like hes in pain,6,26,Alexandra,1.0,Where was your father for all of this?,3,29,Madison,1.0,Yet another person who is crying about being detained by the police. Ridiculous.,5,63,Vanessa,7.0,I feel the numbers are unfair.
27,11,eliminate,3,Feeling of unfairness in society,28.3973214693,4.0,1.95864913101,48,Kelly,3.0,I feel upset because the man looks like he's really hurt and confused. ,54,Heather,8.0,"I feel like the guy is being dragged against his will, i feel sad for him. ",50,Jordan,2.0,A lot of people has someone arrested ,57,Miranda,8.0,I'm really horrified and wondering why they're being arrested,47,Chelsea,4.0,That's alot of cops in the image!,49,Erin,1.0,"I am not sure why this woman is being led by officers, but she doesn't seem to be uncomfortable, and the officers seem to be appropriate, so I am not emotionally motivated.",2.49236412052,5.84344779217,7.97758245142,1,48,Kelly,3.0,I feel upset because the man looks like he's really hurt and confused. ,2,54,Heather,8.0,"I feel like the guy is being dragged against his will, i feel sad for him. ",4,57,Miranda,8.0,I'm really horrified and wondering why they're being arrested,6,49,Erin,1.0,"I am not sure why this woman is being led by officers, but she doesn't seem to be uncomfortable, and the officers seem to be appropriate, so I am not emotionally motivated.",3,50,Jordan,2.0,A lot of people has someone arrested ,5,47,Chelsea,4.0,That's alot of cops in the image!
27,12,eliminate,1,It looks like they are hurting her-- concern,13.0964624578,5.0,3.2093747149,48,Kelly,6.0,I feel upset that the woman is clearly in pain and they are hurting her.,54,Heather,4.0,I feel like the people are forcing the lady to move. ,8,Brittany,1.0,Police arrest female.,57,Miranda,9.0,This shouldn't be the response to protest.,3,Emily,1.0,The police look like they are just doing their job.,43,Sydney,7.0,woman being arrested by police,1.54974084253,2.76675713895,3.55039087446,1,48,Kelly,6.0,I feel upset that the woman is clearly in pain and they are hurting her.,2,54,Heather,4.0,I feel like the people are forcing the lady to move. ,4,57,Miranda,9.0,This shouldn't be the response to protest.,5,3,Emily,1.0,The police look like they are just doing their job.,3,8,Brittany,1.0,Police arrest female.,6,43,Sydney,7.0,woman being arrested by police
27,13,eliminate,18,Concern for this man's safety,20.7078648162,5.0,2.18886734787,48,Kelly,7.0,I feel upset that the man is being hurt for no reason. ,54,Heather,9.0,I feel remorse for the person being tackled by police officers. ,41,Michelle,2.0,"Again, police doing their job...",57,Miranda,6.0,Thats a lot of cops for 1 guy,45,Christina,4.0,police look like arrest could have been doen in a better way,62,Julia,9.0,way too many police brutally arresting just one man. Unacceptable.,2.50259242998,3.66938834276,4.88654490922,1,48,Kelly,7.0,I feel upset that the man is being hurt for no reason. ,2,54,Heather,9.0,I feel remorse for the person being tackled by police officers. ,6,62,Julia,9.0,way too many police brutally arresting just one man. Unacceptable.,4,57,Miranda,6.0,Thats a lot of cops for 1 guy,3,41,Michelle,2.0,"Again, police doing their job...",5,45,Christina,4.0,police look like arrest could have been doen in a better way
27,14,eliminate,7,Concern for the man being detained,14.2750972197,5.0,1.45395949275,48,Kelly,3.0,I feel upset because they are hurting someone who probably didn't deserve it. ,54,Heather,6.0,I feel that there's too many police officers surrounded this man. ,19,Nicole,5.0,"Drop this POC on his head, it can't hurt him anyway.",39,Olivia,5.0,Officers carrying away man who seems visibly distressed. ,38,Shelby,8.0,An african american male being arrested by a police officer,62,Julia,9.0,"Several police carrying away a man they've arrested. Again, brutality.",10.1546987615,12.0216494845,15.0726136986,1,48,Kelly,3.0,I feel upset because they are hurting someone who probably didn't deserve it. ,4,39,Olivia,5.0,Officers carrying away man who seems visibly distressed. ,6,62,Julia,9.0,"Several police carrying away a man they've arrested. Again, brutality.",3,19,Nicole,5.0,"Drop this POC on his head, it can't hurt him anyway.",2,54,Heather,6.0,I feel that there's too many police officers surrounded this man. ,5,38,Shelby,8.0,An african american male being arrested by a police officer
27,15,eliminate,5,Sympathy -- I highly doubt she did anything to deserve this,19.9068832109,7.0,2.2782897888,48,Kelly,6.0,I think that this woman is in a lot of pain and that makes me feel upset. ,12,Rachel,7.0,i really wonder what she did to had have this much force from the police,46,Tiffany,4.0,This looks like they're trying to scare her.,39,Olivia,1.0,Woman arrested. ,37,Kimberly,5.0,This is messed up.,62,Julia,9.0,4 men using force to arrest a small woman.,0.468787348326,1.48594277438,3.96914001916,1,48,Kelly,6.0,I think that this woman is in a lot of pain and that makes me feel upset. ,3,46,Tiffany,4.0,This looks like they're trying to scare her.,5,37,Kimberly,5.0,This is messed up.,6,62,Julia,9.0,4 men using force to arrest a small woman.,4,39,Olivia,1.0,Woman arrested. ,2,12,Rachel,7.0,i really wonder what she did to had have this much force from the police
27,16,eliminate,14,Concern for this person's safety,14.5331906874,5.0,2.25335764301,48,Kelly,8.0,I feel upset to see the woman suffering so much. ,4,Samantha,2.0,"wow, someone is restrained.",46,Tiffany,2.0,This looks like a typical restraint. ,20,Victoria,2.0,this looks to be a pretty routine arrest with the suspect cooperating and the police aren't using excessive force,37,Kimberly,9.0,This is messed up.,18,Jennifer,1.0,Should have listened to the cops,0.0601074263298,1.97693099398,6.14575169921,1,48,Kelly,8.0,I feel upset to see the woman suffering so much. ,4,20,Victoria,2.0,this looks to be a pretty routine arrest with the suspect cooperating and the police aren't using excessive force,5,37,Kimberly,9.0,This is messed up.,6,18,Jennifer,1.0,Should have listened to the cops,2,4,Samantha,2.0,"wow, someone is restrained.",3,46,Tiffany,2.0,This looks like a typical restraint. 
27,17,eliminate,11,Sympathy-- looks like this person is really upset ,18.4456524838,6.0,2.01615101268,48,Kelly,2.0,I honestly feel like I've seen so much police violence that I feel desensitized to it now.,56,Laura,5.0,"Slightly angered, this seems to be an overreaction given the area and number of cops.",10,Elizabeth,2.0,I see to officers hand cuffing a black man at night in an alley.,20,Victoria,3.0,the police are doing a good job of keeping the suspect detained,37,Kimberly,9.0,Get your knee off him.,33,Kelsey,4.0,Procedures have been followed.,0.0278165199343,3.17872913055,5.1123836785,1,48,Kelly,2.0,I honestly feel like I've seen so much police violence that I feel desensitized to it now.,2,56,Laura,5.0,"Slightly angered, this seems to be an overreaction given the area and number of cops.",5,37,Kimberly,9.0,Get your knee off him.,6,33,Kelsey,4.0,Procedures have been followed.,4,20,Victoria,3.0,the police are doing a good job of keeping the suspect detained,3,10,Elizabeth,2.0,I see to officers hand cuffing a black man at night in an alley.
27,18,eliminate,19,Discomfort-- looks like he's in pain,13.4628649302,7.0,1.67576948955,48,Kelly,6.0,I feel hurt that the man is in so much pain. ,56,Laura,1.0,Police seems to be acting appropriately here.,9,Amanda,2.0,I feel bad because sometimes people are just trying to express themselves but they end up in this situation.,61,Gabrielle,8.0,"This man looks a bit crazy, I wonder if he is in pain from his arms being up.",37,Kimberly,9.0,This is messed up.,16,Stephanie,2.0,The guy in the Cardinals shirt looks angry.,0.998024245051,2.83159183697,5.0321098668,1,48,Kelly,6.0,I feel hurt that the man is in so much pain. ,4,61,Gabrielle,8.0,"This man looks a bit crazy, I wonder if he is in pain from his arms being up.",5,37,Kimberly,9.0,This is messed up.,6,16,Stephanie,2.0,The guy in the Cardinals shirt looks angry.,3,9,Amanda,2.0,I feel bad because sometimes people are just trying to express themselves but they end up in this situation.,2,56,Laura,1.0,Police seems to be acting appropriately here.
27,19,eliminate,15,Frustration-- don't this this force is justified,19.9864642254,4.0,1.82545559256,48,Kelly,7.0,I feel angry because the protesters are unarmed and they are hurting them when they don't have to. ,35,Melissa,4.0,People arep protesting and the cops are trying to contain the protest,55,Andrea,3.0,"My response is excitement for all the action, although I don't know what side I'd be on.",61,Gabrielle,7.0,It's hard to tell what the situation is but I wonder why they are ramming into a man who has no weapons and his hands are up.,37,Kimberly,9.0,This is messed up.,2,Ashley,1.0,Exessive force.,2.54013519524,4.72408425326,8.30868277301,1,48,Kelly,7.0,I feel angry because the protesters are unarmed and they are hurting them when they don't have to. ,4,61,Gabrielle,7.0,It's hard to tell what the situation is but I wonder why they are ramming into a man who has no weapons and his hands are up.,5,37,Kimberly,9.0,This is messed up.,6,2,Ashley,1.0,Exessive force.,3,55,Andrea,3.0,"My response is excitement for all the action, although I don't know what side I'd be on.",2,35,Melissa,4.0,People arep protesting and the cops are trying to contain the protest
27,20,eliminate,17,Sad-- this man looks confused about why they are being so needlessly aggressive,28.2336975983,4.0,2.46462799927,48,Kelly,5.0,I feel really upset because they are really seriously hurting someone that is unarmed. ,22,Amber,1.0,more police arresting a recalcitrant black,59,Katelyn,5.0,Confusion is on display as the detainee probably thought he was not going to get arrested.,61,Gabrielle,7.0,Not sure what is going on but don't know that the choke hold is appropriate.,37,Kimberly,9.0,This is messed up.,17,Courtney,8.0,Just let him go.,3.92938457942,7.68077416522,11.0480402107,1,48,Kelly,5.0,I feel really upset because they are really seriously hurting someone that is unarmed. ,4,61,Gabrielle,7.0,Not sure what is going on but don't know that the choke hold is appropriate.,5,37,Kimberly,9.0,This is messed up.,2,22,Amber,1.0,more police arresting a recalcitrant black,3,59,Katelyn,5.0,Confusion is on display as the detainee probably thought he was not going to get arrested.,6,17,Courtney,8.0,Just let him go.
