subject_id,trial,condition,stimulus,subject_title,title_time,subject_rating,rating_time,a1_id,a1_name,a1_rating,a1_title,a2_id,a2_name,a2_rating,a2_title,a3_id,a3_name,a3_rating,a3_title,a4_id,a4_name,a4_rating,a4_title,a5_id,a5_name,a5_rating,a5_title,a6_id,a6_name,a6_rating,a6_title,selection_time_1,selection_time_2,selection_time_3,kept_1_loc,kept_1_id,kept_1_name,kept_1_rating,kept_1_title,kept_2_loc,kept_2_id,kept_2_name,kept_2_rating,kept_2_title,kept_3_loc,kept_3_id,kept_3_name,kept_3_rating,kept_3_title,elim_1_loc,elim_1_id,elim_1_name,elim_1_rating,elim_1_title,elim_2_loc,elim_2_id,elim_2_name,elim_2_rating,elim_2_title,elim_3_loc,elim_3_id,elim_3_name,elim_3_rating,elim_3_title
62,1,keep,20,scared and upset,7.71926375327,8.0,3.30355578871,48,Kelly,8.0,I feel upset to see that man in pain when he did nothing wrong. ,39,Olivia,6.0,Man lets out emotion after being arrested. ,20,Victoria,3.0,this looks to be more peaceful than violent the man just looks upset,50,Jordan,5.0,This man looks like he is in pain or screaming while being arrested,18,Jennifer,5.0,Should have obeyed the police,1,Jessica,7.0,"Excessive force, no consideration of pain or injury.",1.30990757002,2.05970600317,2.89301158651,4,50,Jordan,5.0,This man looks like he is in pain or screaming while being arrested,2,39,Olivia,6.0,Man lets out emotion after being arrested. ,1,48,Kelly,8.0,I feel upset to see that man in pain when he did nothing wrong. ,3,20,Victoria,3.0,this looks to be more peaceful than violent the man just looks upset,5,18,Jennifer,5.0,Should have obeyed the police,6,1,Jessica,7.0,"Excessive force, no consideration of pain or injury."
62,2,keep,15,i feel upset that he has his hands up but they are still going for him,14.2701649598,8.0,1.87304477242,48,Kelly,7.0,I feel angry because the protesters are unarmed and they are hurting them when they don't have to. ,39,Olivia,8.0,Another act of police brutality.,32,Haley,8.0,the protesters seem peaceful,50,Jordan,1.0,A man looks like he is being bashed by police,3,Emily,1.0,The police look like they are just doing their job.,54,Heather,1.0,I feel like the police are acting in unity in the photo. ,1.55392528058,2.1038528647,3.02063309692,6,54,Heather,1.0,I feel like the police are acting in unity in the photo. ,5,3,Emily,1.0,The police look like they are just doing their job.,2,39,Olivia,8.0,Another act of police brutality.,1,48,Kelly,7.0,I feel angry because the protesters are unarmed and they are hurting them when they don't have to. ,3,32,Haley,8.0,the protesters seem peaceful,4,50,Jordan,1.0,A man looks like he is being bashed by police
62,3,keep,18,I feel scared for the man because it looks like the police are being aggressive,18.4854090639,7.0,2.07378803252,34,Allison,6.0,One officer almost looks pleased,39,Olivia,6.0,Police wrestle man to ground. ,52,Brooke,8.0,why do they have to tackle him,11,Kayla,8.0,I fucking hate this survey. Thanks for ruining my day... ,3,Emily,1.0,The police look like they are just doing their job.,54,Heather,9.0,I feel remorse for the person being tackled by police officers. ,5.7655987707,6.63271285698,7.64934112993,2,39,Olivia,6.0,Police wrestle man to ground. ,1,34,Allison,6.0,One officer almost looks pleased,5,3,Emily,1.0,The police look like they are just doing their job.,3,52,Brooke,8.0,why do they have to tackle him,4,11,Kayla,8.0,I fucking hate this survey. Thanks for ruining my day... ,6,54,Heather,9.0,I feel remorse for the person being tackled by police officers. 
62,4,keep,7,"i feel like in this case the police are being too harsh, but maybe are just doing their jobs",21.8678721718,6.0,2.17624903063,34,Allison,7.0,I wonder what he did to deserve that,39,Olivia,5.0,Officers carrying away man who seems visibly distressed. ,58,Paige,7.0,He needs to calm down and take his punishment.,29,Madison,1.0,I need to context to understand what is happening in the picture.,3,Emily,1.0,The police look like they are just doing their job.,25,Jasmine,5.0,I feel sad.,0.661831151345,1.22850561084,2.02856206091,4,29,Madison,1.0,I need to context to understand what is happening in the picture.,3,58,Paige,7.0,He needs to calm down and take his punishment.,5,3,Emily,1.0,The police look like they are just doing their job.,1,34,Allison,7.0,I wonder what he did to deserve that,2,39,Olivia,5.0,Officers carrying away man who seems visibly distressed. ,6,25,Jasmine,5.0,I feel sad.
62,5,keep,6,I would need to know more to understand what is going on,29.0238382105,6.0,2.18884881632,35,Melissa,5.0,cops arresting someone who was probably up to no good,36,Abigail,1.0,You better pray!,58,Paige,7.0,"And he is face down, must have been pretty bad for the position he is in. ",29,Madison,1.0,I don't know what this person did to be detained.,3,Emily,1.0,I have no real response to this one.,15,Lauren,3.0,You will not be in this position if you comply.,3.0623337857,3.52946668875,4.16298296233,1,35,Melissa,5.0,cops arresting someone who was probably up to no good,6,15,Lauren,3.0,You will not be in this position if you comply.,5,3,Emily,1.0,I have no real response to this one.,2,36,Abigail,1.0,You better pray!,3,58,Paige,7.0,"And he is face down, must have been pretty bad for the position he is in. ",4,29,Madison,1.0,I don't know what this person did to be detained.
62,6,keep,16,"It looks like he probably is in this position because of something he did, and the police aren't being too harsh",44.6471415701,5.0,1.79000319319,35,Melissa,4.0,Cops arresting a protester who was posing a threat to society,51,Natalie,7.0,This picture scares me,12,Rachel,6.0,attacing on these peope ,8,Brittany,1.0,Cops subdue man on street.,3,Emily,1.0,The police look like they are just doing their job.,15,Lauren,3.0,This guy looks like he was trying to get arrested.,1.00345343724,2.08714846964,2.63770356262,2,51,Natalie,7.0,This picture scares me,1,35,Melissa,4.0,Cops arresting a protester who was posing a threat to society,6,15,Lauren,3.0,This guy looks like he was trying to get arrested.,3,12,Rachel,6.0,attacing on these peope ,4,8,Brittany,1.0,Cops subdue man on street.,5,3,Emily,1.0,The police look like they are just doing their job.
62,7,keep,10,I am angry on behalf of this person because he seems completely compliant,17.0262213757,9.0,1.63370215998,35,Melissa,3.0,cops carrying away a man who was probably resisting arrest,51,Natalie,8.0,I am confused,62,Julia,9.0,"Police carrying a man away by his limbs, this literally disgusts me.",9,Amanda,2.0,People have to stop acting like they can do just anything that comes to mind.,42,Kaitlyn,4.0,A black man is being carried and held by police officers.,15,Lauren,2.0,Going limp has been a tactic for years.,1.57444205601,3.10800451611,3.84208272514,3,62,Julia,9.0,"Police carrying a man away by his limbs, this literally disgusts me.",1,35,Melissa,3.0,cops carrying away a man who was probably resisting arrest,5,42,Kaitlyn,4.0,A black man is being carried and held by police officers.,2,51,Natalie,8.0,I am confused,4,9,Amanda,2.0,People have to stop acting like they can do just anything that comes to mind.,6,15,Lauren,2.0,Going limp has been a tactic for years.
62,8,keep,5,The force being used on this woman upsets me,16.1088025157,7.0,1.88309688889,35,Melissa,4.0,woman protester being arrested and resisting,23,Morgan,1.0,I am curious as to what is happening and why the police as so close to the woman.,62,Julia,9.0,4 men using force to arrest a small woman.,49,Erin,1.0,"I feel like this arrest is going acceptably at this point, I don't feel the officiers or the arrested person are behaving too inappropriately at this time.",42,Kaitlyn,5.0,A black woman is being arrested and held by police officers.,55,Andrea,1.0,My response is confusion as to what is happening.,1.87284691178,2.77347014414,3.67355881084,2,23,Morgan,1.0,I am curious as to what is happening and why the police as so close to the woman.,1,35,Melissa,4.0,woman protester being arrested and resisting,5,42,Kaitlyn,5.0,A black woman is being arrested and held by police officers.,3,62,Julia,9.0,4 men using force to arrest a small woman.,4,49,Erin,1.0,"I feel like this arrest is going acceptably at this point, I don't feel the officiers or the arrested person are behaving too inappropriately at this time.",6,55,Andrea,1.0,My response is confusion as to what is happening.
62,9,keep,19,I need to know more about what this man did to make a judgment,22.8346258895,6.0,1.82744531753,35,Melissa,9.0,cops arresting someone who was probably resisting arrest,23,Morgan,2.0,I feel worried for the man being restrained and the officers as well as he seems distressed.,33,Kelsey,6.0,Person appears extremely angry.,41,Michelle,3.0,"Again, police doing their job...",42,Kaitlyn,5.0,A black man is being arrested and held by police officers.,61,Gabrielle,8.0,"This man looks a bit crazy, I wonder if he is in pain from his arms being up.",2.15371059894,3.18685624027,3.72118476871,4,41,Michelle,3.0,"Again, police doing their job...",1,35,Melissa,9.0,cops arresting someone who was probably resisting arrest,6,61,Gabrielle,8.0,"This man looks a bit crazy, I wonder if he is in pain from his arms being up.",2,23,Morgan,2.0,I feel worried for the man being restrained and the officers as well as he seems distressed.,3,33,Kelsey,6.0,Person appears extremely angry.,5,42,Kaitlyn,5.0,A black man is being arrested and held by police officers.
62,10,keep,3,"confusion as to why there are so many officers for one person, and why there are bystanders recording on their phones",29.0397708352,6.0,1.88953648158,35,Melissa,4.0,a man being arrested by police,2,Ashley,1.0,Cool picture.,4,Samantha,2.0,why is he in short.,41,Michelle,2.0,"Again, police doing their job...",17,Courtney,6.0,Looks like a peaceful protester.,61,Gabrielle,1.0,Dn't know what is going on but I do hope they aressted this person legally.,1.00444416574,2.17115198204,2.92174556386,2,2,Ashley,1.0,Cool picture.,6,61,Gabrielle,1.0,Dn't know what is going on but I do hope they aressted this person legally.,5,17,Courtney,6.0,Looks like a peaceful protester.,1,35,Melissa,4.0,a man being arrested by police,3,4,Samantha,2.0,why is he in short.,4,41,Michelle,2.0,"Again, police doing their job..."
62,11,keep,2,I feel empathy for this woman who looks very stoic and strong,19.2593567534,7.0,1.70152957086,60,Sierra,7.0,This looks like a form of racial profiling by the police,2,Ashley,1.0,She looks peaceful to me. I wonder why she is being arrested?,21,Brianna,7.0,peacefully getting arrest for making a statement during protest,47,Chelsea,4.0,The woman in the picture looks pretty upset.,17,Courtney,7.0,She doesn't look like a criminal.,61,Gabrielle,7.0,It looks like she got arrested at a protest of some sort.,0.929304180783,1.57944929751,2.47964715818,2,2,Ashley,1.0,She looks peaceful to me. I wonder why she is being arrested?,3,21,Brianna,7.0,peacefully getting arrest for making a statement during protest,1,60,Sierra,7.0,This looks like a form of racial profiling by the police,4,47,Chelsea,4.0,The woman in the picture looks pretty upset.,5,17,Courtney,7.0,She doesn't look like a criminal.,6,61,Gabrielle,7.0,It looks like she got arrested at a protest of some sort.
62,12,keep,1,This woman seems to be acting aggressively toward the cops rather than complying,22.5120110505,4.0,2.14937448676,60,Sierra,6.0,This looks like police trying to silence a peaceful protester,2,Ashley,1.0,The only thing I notice is she needed two handcuffs.,21,Brianna,7.0,Women gets arrest trying to express her feeling about inequality ,28,Rebecca,2.0,Was she protesting peacefully?,45,Christina,4.0,A young woman shouting at officers while being arrested.,22,Amber,3.0,Looks like the police are arresting another loud mouth entitled black woman.,1.54053832905,3.10810601222,4.55790359003,1,60,Sierra,6.0,This looks like police trying to silence a peaceful protester,5,45,Christina,4.0,A young woman shouting at officers while being arrested.,2,2,Ashley,1.0,The only thing I notice is she needed two handcuffs.,3,21,Brianna,7.0,Women gets arrest trying to express her feeling about inequality ,4,28,Rebecca,2.0,Was she protesting peacefully?,6,22,Amber,3.0,Looks like the police are arresting another loud mouth entitled black woman.
62,13,keep,11,I am upset by how aggressive the police are being,9.92360157601,9.0,1.96594745002,60,Sierra,9.0,This looks like a case of racial profiling and police brutality.,2,Ashley,1.0,Dont riot and you will not be arrested. Protesting with violence is rioting.,38,Shelby,8.0,An african american male being arrested by a police officer,24,Danielle,3.0,Black male on the ground being arrested by police ,45,Christina,3.0,"The subdued guy should try to stay quiet whether or not the arrest is proper, easier said than done of course.",10,Elizabeth,2.0,I see to officers hand cuffing a black man at night in an alley.,1.91222430661,2.84565219877,4.04598890385,3,38,Shelby,8.0,An african american male being arrested by a police officer,4,24,Danielle,3.0,Black male on the ground being arrested by police ,5,45,Christina,3.0,"The subdued guy should try to stay quiet whether or not the arrest is proper, easier said than done of course.",1,60,Sierra,9.0,This looks like a case of racial profiling and police brutality.,2,2,Ashley,1.0,Dont riot and you will not be arrested. Protesting with violence is rioting.,6,10,Elizabeth,2.0,I see to officers hand cuffing a black man at night in an alley.
62,14,keep,13,I feel very scared for the man on the ground and confused by the situaton,16.2341748585,8.0,4.92749863153,40,Mary,4.0,Black people versus white cops,44,Maria,4.0,to much chaos going on,38,Shelby,7.0,An african american male being arrested by a police officer,24,Danielle,3.0,Black male being arrested by police ,45,Christina,4.0,Force may have been necessary but looks egregrious when multiple cops are around a guy on the ground.,13,Megan,7.0,I wonder if this man was resisting.,0.858499737689,1.52440071618,2.44234843994,3,38,Shelby,7.0,An african american male being arrested by a police officer,4,24,Danielle,3.0,Black male being arrested by police ,6,13,Megan,7.0,I wonder if this man was resisting.,1,40,Mary,4.0,Black people versus white cops,2,44,Maria,4.0,to much chaos going on,5,45,Christina,4.0,Force may have been necessary but looks egregrious when multiple cops are around a guy on the ground.
62,15,keep,12,I feel sad for this man who looks so helpless,10.5110762019,6.0,2.37970104231,57,Miranda,5.0,He looks like he wants mercy from these cops,37,Kimberly,9.0,This is messed up.,38,Shelby,7.0,An african american male being arrested by a police officer,24,Danielle,4.0,Black person on the ground being handcuffed by police ,56,Laura,6.0,"Police appear to be overreacting here, so I am somewhat upset.  ",13,Megan,7.0,Stop the violence,0.977346102125,2.07751744823,2.52737461228,6,13,Megan,7.0,Stop the violence,2,37,Kimberly,9.0,This is messed up.,3,38,Shelby,7.0,An african american male being arrested by a police officer,1,57,Miranda,5.0,He looks like he wants mercy from these cops,4,24,Danielle,4.0,Black person on the ground being handcuffed by police ,5,56,Laura,6.0,"Police appear to be overreacting here, so I am somewhat upset.  "
62,16,keep,8,"I feel like this picture embodies the white cops vs. black man situation of today, which makes me upset",39.8563047396,8.0,1.49333175574,19,Nicole,7.0,Going to jail.,37,Kimberly,6.0,This is very common and getting out of hand.,38,Shelby,6.0,An african american male being arrested by a police officer,63,Vanessa,7.0,I feel angry and ashamed.,46,Tiffany,5.0,This makes me mad. ,13,Megan,7.0,Why so many officers?,0.792454782873,1.47597105638,1.97638274333,4,63,Vanessa,7.0,I feel angry and ashamed.,5,46,Tiffany,5.0,This makes me mad. ,6,13,Megan,7.0,Why so many officers?,1,19,Nicole,7.0,Going to jail.,2,37,Kimberly,6.0,This is very common and getting out of hand.,3,38,Shelby,6.0,An african american male being arrested by a police officer
62,17,keep,9,I am very upset by how clearly this person is in pain,17.2783907149,9.0,1.93203716585,16,Stephanie,3.0,What was this guy protesting?,6,Taylor,2.0,Yelling isn't going to help when you are completely surrounded by cops.,59,Katelyn,7.0,I feel the anger of the detainee in this pic.,63,Vanessa,7.0,I feel the numbers are unfair.,46,Tiffany,3.0,This man looks upset and in pain.,13,Megan,7.0,What is he holding at his neck?,1.73017944302,2.46393947862,3.71445209149,2,6,Taylor,2.0,Yelling isn't going to help when you are completely surrounded by cops.,4,63,Vanessa,7.0,I feel the numbers are unfair.,6,13,Megan,7.0,What is he holding at his neck?,1,16,Stephanie,3.0,What was this guy protesting?,3,59,Katelyn,7.0,I feel the anger of the detainee in this pic.,5,46,Tiffany,3.0,This man looks upset and in pain.
62,18,keep,17,I am confused by the situation,17.520782205,5.0,2.03930668964,7,Hannah,9.0,It is disturbing- why are they choking this man- they could seriously injure or kill him ,6,Taylor,7.0,This is a very intense scene.,27,Alyssa,7.0,Protester arrested after attacking police.,63,Vanessa,7.0,I want to know what this man has done and if this force is warranted.,26,Alexandra,3.0,What did this guy do?,13,Megan,7.0,Looks like someone unexpectedly got caught.,1.05127069843,1.70150818815,3.86898406851,2,6,Taylor,7.0,This is a very intense scene.,3,27,Alyssa,7.0,Protester arrested after attacking police.,6,13,Megan,7.0,Looks like someone unexpectedly got caught.,1,7,Hannah,9.0,It is disturbing- why are they choking this man- they could seriously injure or kill him ,4,63,Vanessa,7.0,I want to know what this man has done and if this force is warranted.,5,26,Alexandra,3.0,What did this guy do?
62,19,keep,4,I am less upset by this picture because it seems more one-on-one,26.7356827616,5.0,1.71137014194,14,Alexis,5.0,He looks shock at what is going on in the world.,6,Taylor,1.0,That man's in trouble.,27,Alyssa,7.0,Law enforcement arrests surprised drug dealer. ,43,Sydney,6.0,man arrested and being taken from the scene,53,Marissa,1.0,Wonderign what he is thinking,13,Megan,7.0,He looks terrified!,0.862306986121,1.44579018792,2.91258296452,4,43,Sydney,6.0,man arrested and being taken from the scene,3,27,Alyssa,7.0,Law enforcement arrests surprised drug dealer. ,5,53,Marissa,1.0,Wonderign what he is thinking,1,14,Alexis,5.0,He looks shock at what is going on in the world.,2,6,Taylor,1.0,That man's in trouble.,6,13,Megan,7.0,He looks terrified!
62,20,keep,14,I am getting more and more upset by all of these pictures,15.4780340525,8.0,2.26519079006,30,Katherine,5.0,Mace seems to insight more rioting that preventing it.,31,Anna,2.0,The police made several arrests during the protest.,27,Alyssa,8.0,Law enforcement arrests man after robbing convenience store.,43,Sydney,7.0,police arresting someone,53,Marissa,1.0,Wondering what is going on,5,Sarah,2.0,"an unarmed black man has been taken down by two policemen for no reason, i am not sure why but he probably did nothing wrong",0.958437015302,2.22558987548,2.8592307386,1,30,Katherine,5.0,Mace seems to insight more rioting that preventing it.,3,27,Alyssa,8.0,Law enforcement arrests man after robbing convenience store.,4,43,Sydney,7.0,police arresting someone,2,31,Anna,2.0,The police made several arrests during the protest.,5,53,Marissa,1.0,Wondering what is going on,6,5,Sarah,2.0,"an unarmed black man has been taken down by two policemen for no reason, i am not sure why but he probably did nothing wrong"
